### ISSUE TITLE
openvcx do not work with gst-rtsp-server : "EROR RTSP Error Status code 404 NOT FOUND"

### ISSUE THREAD

**Issue by Sfinx** [openvcx/openvcx#2]
Trying to connect to gst-rtsp-server getting constant "Status code 404 NOT FOUND"

```
./openvsx/bin/vsx -vvv --capture="rtsp://10.1.1.243:8555/ring01" --mkvrecord=output.webm 

OpenVSX v1.8.0.b124 x86_32 (ssl)
Visit the knowledge base at http://openvcx.com for help and examples.
[4143320832] Enabling PES extraction for output stream
[4143320832] SETUP CAP...pes:2
[4143320832] Created outfmt pktq[800] 320 x slotsz:20000, slotszmax:320000
[4140391232] LiveQ reader 0 thread started
[4143320832] Starting mkvlive recording[0] 1/1 to output.webm
[4143320832] Trying to SETUP RTSP to rtsp://10.1.1.243:8555/ring01
[4143320832] RTSP connecting to 10.1.1.243:8555
[4143320832] socket receive buffer set to: 393214
[4143320832] RTSP connected to 10.1.1.243:8555
[4143320832] RTSP Status code 200 OK received from 10.1.1.243:8555
[4143320832] RTSP Status code 200 OK received from 10.1.1.243:8555
[4143320832] SDP ignoring atributes 'tool:GStreamer'
[4143320832] SDP ignoring atributes 'type:broadcast'
[4143320832] SDP control attribute *= references unknown media section
[4143320832] SDP ignoring atributes 'range:npt=now-'
[4143320832] SDP ignoring atributes 'ts-refclk:local'
[4143320832] SDP ignoring atributes 'mediaclk:sender'
[4143320832] Setting RTSP Content-Base to 'rtsp://10.1.1.243:8555/ring01/'
[4143320832] EROR RTSP Error Status code 404 NOT FOUND received from 10.1.1.243:8555
[4143320832] EROR Invalid RTSP SETUP response.
[4140391232] LiveQ reader 0 thread exiting (rc:0) 
[4143320832] All streaming done
[4143320832] OpenVSX exiting
```

tcpdump for openvcx:

```
tcpdump -XX -i lo port 8555

tcpdump: verbose output suppressed, use -v or -vv for full protocol decode
listening on lo, link-type EN10MB (Ethernet), capture size 262144 bytes
16:12:49.713604 IP Yasha.32954 > Yasha.8555: Flags [S], seq 4257847589, win 65535, options [mss 65495,sackOK,TS val 1983962688 ecr 0,nop,wscale 2], length 0
	0x0000:  0000 0000 0000 0000 0000 0000 0800 4500  ..............E.
	0x0010:  003c a1b9 4000 4006 811b 0a01 01f3 0a01  .<..@.@.........
	0x0020:  01f3 80ba 216b fdc9 9925 0000 0000 a002  ....!k...%......
	0x0030:  ffff 1816 0000 0204 ffd7 0402 080a 7640  ..............v@
	0x0040:  de40 0000 0000 0103 0302                 .@........
16:12:49.713615 IP Yasha.8555 > Yasha.32954: Flags [S.], seq 4119104066, ack 4257847590, win 43690, options [mss 65495,sackOK,TS val 1983962688 ecr 1983962688,nop,wscale 7], length 0
	0x0000:  0000 0000 0000 0000 0000 0000 0800 4500  ..............E.
	0x0010:  003c 0000 4000 4006 22d5 0a01 01f3 0a01  .<..@.@.".......
	0x0020:  01f3 216b 80ba f584 8a42 fdc9 9926 a012  ..!k.....B...&..
	0x0030:  aaaa 1816 0000 0204 ffd7 0402 080a 7640  ..............v@
	0x0040:  de40 7640 de40 0103 0307                 .@v@.@....
16:12:49.713623 IP Yasha.32954 > Yasha.8555: Flags [.], ack 1, win 32748, options [nop,nop,TS val 1983962688 ecr 1983962688], length 0
	0x0000:  0000 0000 0000 0000 0000 0000 0800 4500  ..............E.
	0x0010:  0034 a1ba 4000 4006 8122 0a01 01f3 0a01  .4..@.@.."......
	0x0020:  01f3 80ba 216b fdc9 9926 f584 8a43 8010  ....!k...&...C..
	0x0030:  7fec 180e 0000 0101 080a 7640 de40 7640  ..........v@.@v@
	0x0040:  de40                                     .@
16:12:49.713655 IP Yasha.32954 > Yasha.8555: Flags [P.], seq 1:81, ack 1, win 32748, options [nop,nop,TS val 1983962688 ecr 1983962688], length 80
	0x0000:  0000 0000 0000 0000 0000 0000 0800 4500  ..............E.
	0x0010:  0084 a1bb 4000 4006 80d1 0a01 01f3 0a01  ....@.@.........
	0x0020:  01f3 80ba 216b fdc9 9926 f584 8a43 8018  ....!k...&...C..
	0x0030:  7fec 185e 0000 0101 080a 7640 de40 7640  ...^......v@.@v@
	0x0040:  de40 4f50 5449 4f4e 5320 7274 7370 3a2f  .@OPTIONS.rtsp:/
	0x0050:  2f31 302e 312e 312e 3234 333a 3835 3535  /10.1.1.243:8555
	0x0060:  2f72 696e 6730 3120 5254 5350 2f31 2e30  /ring01.RTSP/1.0
	0x0070:  0d0a 4353 6571 3a20 310d 0a55 7365 722d  ..CSeq:.1..User-
	0x0080:  4167 656e 743a 204f 7065 6e56 5358 0d0a  Agent:.OpenVSX..
	0x0090:  0d0a                                     ..

```

stock ffplay (and other players like mplayer, mpv, vlc, etc.) is working perfectly with the same RTSP stream, tcpdump for working stream:

```
tcpdump -XX -i lo port 8555

tcpdump: verbose output suppressed, use -v or -vv for full protocol decode
listening on lo, link-type EN10MB (Ethernet), capture size 262144 bytes
16:17:14.953833 IP Yasha.32964 > Yasha.8555: Flags [S], seq 613294871, win 43690, options [mss 65495,sackOK,TS val 1984227926 ecr 0,nop,wscale 7], length 0
	0x0000:  0000 0000 0000 0000 0000 0000 0800 4500  ..............E.
	0x0010:  003c 18b5 4000 4006 0a20 0a01 01f3 0a01  .<..@.@.........
	0x0020:  01f3 80c4 216b 248e 2317 0000 0000 a002  ....!k$.#.......
	0x0030:  aaaa 1816 0000 0204 ffd7 0402 080a 7644  ..............vD
	0x0040:  ea56 0000 0000 0103 0307                 .V........
16:17:14.953851 IP Yasha.8555 > Yasha.32964: Flags [S.], seq 2893681232, ack 613294872, win 43690, options [mss 65495,sackOK,TS val 1984227926 ecr 1984227926,nop,wscale 7], length 0
	0x0000:  0000 0000 0000 0000 0000 0000 0800 4500  ..............E.
	0x0010:  003c 0000 4000 4006 22d5 0a01 01f3 0a01  .<..@.@.".......
	0x0020:  01f3 216b 80c4 ac7a 1250 248e 2318 a012  ..!k...z.P$.#...
	0x0030:  aaaa 1816 0000 0204 ffd7 0402 080a 7644  ..............vD
	0x0040:  ea56 7644 ea56 0103 0307                 .VvD.V....
16:17:14.953868 IP Yasha.32964 > Yasha.8555: Flags [.], ack 1, win 342, options [nop,nop,TS val 1984227926 ecr 1984227926], length 0
	0x0000:  0000 0000 0000 0000 0000 0000 0800 4500  ..............E.
	0x0010:  0034 18b6 4000 4006 0a27 0a01 01f3 0a01  .4..@.@..'......
	0x0020:  01f3 80c4 216b 248e 2318 ac7a 1251 8010  ....!k$.#..z.Q..
	0x0030:  0156 180e 0000 0101 080a 7644 ea56 7644  .V........vD.VvD
	0x0040:  ea56                                     .V
16:17:14.953914 IP Yasha.32964 > Yasha.8555: Flags [P.], seq 1:87, ack 1, win 342, options [nop,nop,TS val 1984227926 ecr 1984227926], length 86
	0x0000:  0000 0000 0000 0000 0000 0000 0800 4500  ..............E.
	0x0010:  008a 18b7 4000 4006 09d0 0a01 01f3 0a01  ....@.@.........
	0x0020:  01f3 80c4 216b 248e 2318 ac7a 1251 8018  ....!k$.#..z.Q..
	0x0030:  0156 1864 0000 0101 080a 7644 ea56 7644  .V.d......vD.VvD
	0x0040:  ea56 4f50 5449 4f4e 5320 7274 7370 3a2f  .VOPTIONS.rtsp:/
	0x0050:  2f31 302e 312e 312e 3234 333a 3835 3535  /10.1.1.243:8555
	0x0060:  2f72 696e 6730 3120 5254 5350 2f31 2e30  /ring01.RTSP/1.0
	0x0070:  0d0a 4353 6571 3a20 310d 0a55 7365 722d  ..CSeq:.1..User-
	0x0080:  4167 656e 743a 204c 6176 6635 372e 3833  Agent:.Lavf57.83
	0x0090:  2e31 3030 0d0a 0d0a                      .100....

```

Can supply any additional info.

**Comment by Sfinx** [comment]
Forgot to mention that this is stock "OpenVSX v1.8.0.b124 x86_32 (ssl)" distro downloaded from official site.
